Sheet: Sheet1
A1: of:=[Sheet2.A2] -> 1997 Baltland
A2: Batter | C2: AB | D2: R | E2: H | F2: RBI | G2: 2B | H2: 3B | I2: HR | J2: W | K2: K | L2: RE | M2: CS | N2: SB | O2: AVG | P2: SLG | Q2: OB% | R2: ChL | S2: ChR | T2: Games
A3: of:=[Sheet2.B2] -> Grieve | B3: of:=[Sheet2.C2] -> Ben | C3: of:=[Sheet2.D2] -> 51 | D3: of:=[Sheet2.E2] -> 9 | E3: of:=[Sheet2.F2] -> 22 | F3: of:=[Sheet2.G2] -> 9 | G3: of:=[Sheet2.H2] -> 7 | H3: of:=[Sheet2.I2] -> 0 | I3: of:=[Sheet2.J2] -> 3 | J3: of:=[Sheet2.K2] -> 3 | K3: of:=[Sheet2.L2] -> 16 | L3: of:=[Sheet2.M2] -> 0 | M3: of:=[Sheet2.N2] -> 0 | N3: of:=[Sheet2.O2] -> 0 | O3: of:=[Sheet2.P2] -> 0 | P3: of:=[Sheet2.Q2] -> D | Q3: of:=[Sheet2.R2] -> E | R3: of:=[Sheet2.S2] -> 12 | S3: of:=[Sheet2.T2] -> C | T3: of:=[Sheet2.U2] -> L
A4: of:=[Sheet2.B3] -> Magadan | B4: of:=[Sheet2.C3] -> Dave | C4: of:=[Sheet2.D3] -> 45 | D4: of:=[Sheet2.E3] -> 8 | E4: of:=[Sheet2.F3] -> 17 | F4: of:=[Sheet2.G3] -> 6 | G4: of:=[Sheet2.H3] -> 2 | H4: of:=[Sheet2.I3] -> 0 | I4: of:=[Sheet2.J3] -> 3 | J4: of:=[Sheet2.K3] -> 6 | K4: of:=[Sheet2.L3] -> 9 | L4: of:=[Sheet2.M3] -> 0 | M4: of:=[Sheet2.N3] -> 0 | N4: of:=[Sheet2.O3] -> 0 | O4: of:=[Sheet2.P3] -> 0 | P4: of:=[Sheet2.Q3] -> C | Q4: of:=[Sheet2.R3] -> E | R4: of:=[Sheet2.S3] -> 8 | S4: of:=[Sheet2.T3] -> B | T4: of:=[Sheet2.U3] -> L
A5: of:=[Sheet2.B4] -> Surhoff | B5: of:=[Sheet2.C4] -> B.J. | C5: of:=[Sheet2.D4] -> 8 | D5: of:=[Sheet2.E4] -> 1 | E5: of:=[Sheet2.F4] -> 3 | F5: of:=[Sheet2.G4] -> 1 | G5: of:=[Sheet2.H4] -> 2 | H5: of:=[Sheet2.I4] -> 0 | I5: of:=[Sheet2.J4] -> 0 | J5: of:=[Sheet2.K4] -> 1 | K5: of:=[Sheet2.L4] -> 1 | L5: of:=[Sheet2.M4] -> 0 | M5: of:=[Sheet2.N4] -> 0 | N5: of:=[Sheet2.O4] -> 0 | O5: of:=[Sheet2.P4] -> 0 | P5: of:=[Sheet2.Q4] -> C | Q5: of:=[Sheet2.R4] -> E | R5: of:=[Sheet2.S4] -> 12 | S5: of:=[Sheet2.T4] -> C | T5: of:=[Sheet2.U4] -> L
A6: of:=[Sheet2.B5] -> Ledesma | B6: of:=[Sheet2.C5] -> Aaron | C6: of:=[Sheet2.D5] -> 57 | D6: of:=[Sheet2.E5] -> 10 | E6: of:=[Sheet2.F5] -> 21 | F6: of:=[Sheet2.G5] -> 8 | G6: of:=[Sheet2.H5] -> 2 | H6: of:=[Sheet2.I5] -> 1 | I6: of:=[Sheet2.J5] -> 2 | J6: of:=[Sheet2.K5] -> 7 | K6: of:=[Sheet2.L5] -> 8 | L6: of:=[Sheet2.M5] -> 3 | M6: of:=[Sheet2.N5] -> 0 | N6: of:=[Sheet2.O5] -> 0 | O6: of:=[Sheet2.P5] -> 0 | P6: of:=[Sheet2.Q5] -> D | Q6: of:=[Sheet2.R5] -> D | R6: of:=[Sheet2.S5] -> 12 | S6: of:=[Sheet2.T5] -> C | T6: of:=[Sheet2.U5] -> R
A7: of:=[Sheet2.B6] -> Baines | B7: of:=[Sheet2.C6] -> Harold | C7: of:=[Sheet2.D6] -> 22 | D7: of:=[Sheet2.E6] -> 2 | E7: of:=[Sheet2.F6] -> 8 | F7: of:=[Sheet2.G6] -> 2 | G7: of:=[Sheet2.H6] -> 2 | H7: of:=[Sheet2.I6] -> 0 | I7: of:=[Sheet2.J6] -> 1 | J7: of:=[Sheet2.K6] -> 4 | K7: of:=[Sheet2.L6] -> 2 | L7: of:=[Sheet2.M6] -> 0 | M7: of:=[Sheet2.N6] -> 0 | N7: of:=[Sheet2.O6] -> 0 | O7: of:=[Sheet2.P6] -> 0 | P7: of:=[Sheet2.Q6] -> D | Q7: of:=[Sheet2.R6] -> E | R7: of:=[Sheet2.S6] -> 8 | S7: of:=[Sheet2.T6] -> C | T7: of:=[Sheet2.U6] -> L
A8: of:=[Sheet2.B7] -> Palmerio | B8: of:=[Sheet2.C7] -> Rafael | C8: of:=[Sheet2.D7] -> 12 | D8: of:=[Sheet2.E7] -> 3 | E8: of:=[Sheet2.F7] -> 4 | F8: of:=[Sheet2.G7] -> 2 | G8: of:=[Sheet2.H7] -> 1 | H8: of:=[Sheet2.I7] -> 0 | I8: of:=[Sheet2.J7] -> 1 | J8: of:=[Sheet2.K7] -> 0 | K8: of:=[Sheet2.L7] -> 4 | L8: of:=[Sheet2.M7] -> 0 | M8: of:=[Sheet2.N7] -> 0 | N8: of:=[Sheet2.O7] -> 0 | O8: of:=[Sheet2.P7] -> 0 | P8: of:=[Sheet2.Q7] -> D | Q8: of:=[Sheet2.R7] -> D | R8: of:=[Sheet2.S7] -> 12 | S8: of:=[Sheet2.T7] -> C | T8: of:=[Sheet2.U7] -> L
A9: of:=[Sheet2.B8] -> Walton | B9: of:=[Sheet2.C8] -> Jerome | C9: of:=[Sheet2.D8] -> 37 | D9: of:=[Sheet2.E8] -> 4 | E9: of:=[Sheet2.F8] -> 11 | F9: of:=[Sheet2.G8] -> 6 | G9: of:=[Sheet2.H8] -> 1 | H9: of:=[Sheet2.I8] -> 0 | I9: of:=[Sheet2.J8] -> 0 | J9: of:=[Sheet2.K8] -> 1 | K9: of:=[Sheet2.L8] -> 5 | L9: of:=[Sheet2.M8] -> 1 | M9: of:=[Sheet2.N8] -> 0 | N9: of:=[Sheet2.O8] -> 0 | O9: of:=[Sheet2.P8] -> 0 | P9: of:=[Sheet2.Q8] -> C | Q9: of:=[Sheet2.R8] -> E | R9: of:=[Sheet2.S8] -> 12 | S9: of:=[Sheet2.T8] -> C | T9: of:=[Sheet2.U8] -> R
A10: of:=[Sheet2.B9] -> Bournigal | B10: of:=[Sheet2.C9] -> Rafael | C10: of:=[Sheet2.D9] -> 28 | D10: of:=[Sheet2.E9] -> 2 | E10: of:=[Sheet2.F9] -> 8 | F10: of:=[Sheet2.G9] -> 9 | G10: of:=[Sheet2.H9] -> 3 | H10: of:=[Sheet2.I9] -> 0 | I10: of:=[Sheet2.J9] -> 1 | J10: of:=[Sheet2.K9] -> 6 | K10: of:=[Sheet2.L9] -> 4 | L10: of:=[Sheet2.M9] -> 1 | M10: of:=[Sheet2.N9] -> 0 | N10: of:=[Sheet2.O9] -> 0 | O10: of:=[Sheet2.P9] -> 0 | P10: of:=[Sheet2.Q9] -> A | Q10: of:=[Sheet2.R9] -> D | R10: of:=[Sheet2.S9] -> 13 | S10: of:=[Sheet2.T9] -> B | T10: of:=[Sheet2.U9] -> R
A11: of:=[Sheet2.B10] -> Williams | B11: of:=[Sheet2.C10] -> George | C11: of:=[Sheet2.D10] -> 55 | D11: of:=[Sheet2.E10] -> 12 | E11: of:=[Sheet2.F10] -> 15 | F11: of:=[Sheet2.G10] -> 9 | G11: of:=[Sheet2.H10] -> 0 | H11: of:=[Sheet2.I10] -> 0 | I11: of:=[Sheet2.J10] -> 4 | J11: of:=[Sheet2.K10] -> 6 | K11: of:=[Sheet2.L10] -> 14 | L11: of:=[Sheet2.M10] -> 1 | M11: of:=[Sheet2.N10] -> 0 | N11: of:=[Sheet2.O10] -> 0 | O11: of:=[Sheet2.P10] -> 0 | P11: of:=[Sheet2.Q10] -> C | Q11: of:=[Sheet2.R10] -> E | R11: of:=[Sheet2.S10] -> 10 | S11: of:=[Sheet2.T10] -> C | T11: of:=[Sheet2.U10] -> S
A12: of:=[Sheet2.B11] -> Ripken | B12: of:=[Sheet2.C11] -> Cal | C12: of:=[Sheet2.D11] -> 38 | D12: of:=[Sheet2.E11] -> 5 | E12: of:=[Sheet2.F11] -> 10 | F12: of:=[Sheet2.G11] -> 3 | G12: of:=[Sheet2.H11] -> 1 | H12: of:=[Sheet2.I11] -> 0 | I12: of:=[Sheet2.J11] -> 3 | J12: of:=[Sheet2.K11] -> 6 | K12: of:=[Sheet2.L11] -> 5 | L12: of:=[Sheet2.M11] -> 0 | M12: of:=[Sheet2.N11] -> 0 | N12: of:=[Sheet2.O11] -> 0 | O12: of:=[Sheet2.P11] -> 0 | P12: of:=[Sheet2.Q11] -> D | Q12: of:=[Sheet2.R11] -> E | R12: of:=[Sheet2.S11] -> 10 | S12: of:=[Sheet2.T11] -> B | T12: of:=[Sheet2.U11] -> R
A13: of:=[Sheet2.B12] -> Alomar | B13: of:=[Sheet2.C12] -> Roberto | C13: of:=[Sheet2.D12] -> 54 | D13: of:=[Sheet2.E12] -> 11 | E13: of:=[Sheet2.F12] -> 14 | F13: of:=[Sheet2.G12] -> 9 | G13: of:=[Sheet2.H12] -> 1 | H13: of:=[Sheet2.I12] -> 0 | I13: of:=[Sheet2.J12] -> 4 | J13: of:=[Sheet2.K12] -> 4 | K13: of:=[Sheet2.L12] -> 6 | L13: of:=[Sheet2.M12] -> 1 | M13: of:=[Sheet2.N12] -> 0 | N13: of:=[Sheet2.O12] -> 0 | O13: of:=[Sheet2.P12] -> 0 | P13: of:=[Sheet2.Q12] -> A | Q13: of:=[Sheet2.R12] -> B | R13: of:=[Sheet2.S12] -> 15 | S13: of:=[Sheet2.T12] -> B | T13: of:=[Sheet2.U12] -> S
A14: of:=[Sheet2.B13] -> Giambi | B14: of:=[Sheet2.C13] -> Jason | C14: of:=[Sheet2.D13] -> 28 | D14: of:=[Sheet2.E13] -> 2 | E14: of:=[Sheet2.F13] -> 7 | F14: of:=[Sheet2.G13] -> 7 | G14: of:=[Sheet2.H13] -> 0 | H14: of:=[Sheet2.I13] -> 1 | I14: of:=[Sheet2.J13] -> 1 | J14: of:=[Sheet2.K13] -> 1 | K14: of:=[Sheet2.L13] -> 8 | L14: of:=[Sheet2.M13] -> 0 | M14: of:=[Sheet2.N13] -> 0 | N14: of:=[Sheet2.O13] -> 0 | O14: of:=[Sheet2.P13] -> 0 | P14: of:=[Sheet2.Q13] -> D | Q14: of:=[Sheet2.R13] -> E | R14: of:=[Sheet2.S13] -> 11 | S14: of:=[Sheet2.T13] -> C | T14: of:=[Sheet2.U13] -> L
A15: of:=[Sheet2.B14] -> Hammonds | B15: of:=[Sheet2.C14] -> Jeffrey | C15: of:=[Sheet2.D14] -> 4 | D15: of:=[Sheet2.E14] -> 0 | E15: of:=[Sheet2.F14] -> 1 | F15: of:=[Sheet2.G14] -> 1 | G15: of:=[Sheet2.H14] -> 0 | H15: of:=[Sheet2.I14] -> 0 | I15: of:=[Sheet2.J14] -> 0 | J15: of:=[Sheet2.K14] -> 0 | K15: of:=[Sheet2.L14] -> 1 | L15: of:=[Sheet2.M14] -> 0 | M15: of:=[Sheet2.N14] -> 0 | N15: of:=[Sheet2.O14] -> 0 | O15: of:=[Sheet2.P14] -> 0 | P15: of:=[Sheet2.Q14] -> D | Q15: of:=[Sheet2.R14] -> B | R15: of:=[Sheet2.S14] -> 16 | S15: of:=[Sheet2.T14] -> C | T15: of:=[Sheet2.U14] -> R
A16: of:=[Sheet2.B15] -> Anderson | B16: of:=[Sheet2.C15] -> Brady | C16: of:=[Sheet2.D15] -> 37 | D16: of:=[Sheet2.E15] -> 7 | E16: of:=[Sheet2.F15] -> 9 | F16: of:=[Sheet2.G15] -> 3 | G16: of:=[Sheet2.H15] -> 2 | H16: of:=[Sheet2.I15] -> 1 | I16: of:=[Sheet2.J15] -> 0 | J16: of:=[Sheet2.K15] -> 5 | K16: of:=[Sheet2.L15] -> 4 | L16: of:=[Sheet2.M15] -> 2 | M16: of:=[Sheet2.N15] -> 0 | N16: of:=[Sheet2.O15] -> 3 | O16: of:=[Sheet2.P15] -> 1 | P16: of:=[Sheet2.Q15] -> C | Q16: of:=[Sheet2.R15] -> B | R16: of:=[Sheet2.S15] -> 16 | S16: of:=[Sheet2.T15] -> C | T16: of:=[Sheet2.U15] -> L
A17: of:=[Sheet2.B16] -> Berroa | B17: of:=[Sheet2.C16] -> Geronimo | C17: of:=[Sheet2.D16] -> 25 | D17: of:=[Sheet2.E16] -> 6 | E17: of:=[Sheet2.F16] -> 6 | F17: of:=[Sheet2.G16] -> 0 | G17: of:=[Sheet2.H16] -> 1 | H17: of:=[Sheet2.I16] -> 0 | I17: of:=[Sheet2.J16] -> 0 | J17: of:=[Sheet2.K16] -> 2 | K17: of:=[Sheet2.L16] -> 4 | L17: of:=[Sheet2.M16] -> 1 | M17: of:=[Sheet2.N16] -> 0 | N17: of:=[Sheet2.O16] -> 1 | O17: of:=[Sheet2.P16] -> 0 | P17: of:=[Sheet2.Q16] -> D | Q17: of:=[Sheet2.R16] -> D | R17: of:=[Sheet2.S16] -> 12 | S17: of:=[Sheet2.T16] -> D | T17: of:=[Sheet2.U16] -> R
A18: of:=[Sheet2.B17] -> McDonald | B18: of:=[Sheet2.C17] -> Jason | C18: of:=[Sheet2.D17] -> 25 | D18: of:=[Sheet2.E17] -> 1 | E18: of:=[Sheet2.F17] -> 6 | F18: of:=[Sheet2.G17] -> 5 | G18: of:=[Sheet2.H17] -> 1 | H18: of:=[Sheet2.I17] -> 0 | I18: of:=[Sheet2.J17] -> 0 | J18: of:=[Sheet2.K17] -> 6 | K18: of:=[Sheet2.L17] -> 6 | L18: of:=[Sheet2.M17] -> 0 | M18: of:=[Sheet2.N17] -> 0 | N18: of:=[Sheet2.O17] -> 2 | O18: of:=[Sheet2.P17] -> 1 | P18: of:=[Sheet2.Q17] -> B | Q18: of:=[Sheet2.R17] -> B | R18: of:=[Sheet2.S17] -> 16 | S18: of:=[Sheet2.T17] -> D | T18: of:=[Sheet2.U17] -> S
A19: of:=[Sheet2.B18] -> Lennon | B19: of:=[Sheet2.C18] -> Patrick | C19: of:=[Sheet2.D18] -> 18 | D19: of:=[Sheet2.E18] -> 0 | E19: of:=[Sheet2.F18] -> 4 | F19: of:=[Sheet2.G18] -> 0 | G19: of:=[Sheet2.H18] -> 2 | H19: of:=[Sheet2.I18] -> 0 | I19: of:=[Sheet2.J18] -> 0 | J19: of:=[Sheet2.K18] -> 1 | K19: of:=[Sheet2.L18] -> 10 | L19: of:=[Sheet2.M18] -> 0 | M19: of:=[Sheet2.N18] -> 0 | N19: of:=[Sheet2.O18] -> 0 | O19: of:=[Sheet2.P18] -> 0 | P19: of:=[Sheet2.Q18] -> D | Q19: of:=[Sheet2.R18] -> E | R19: of:=[Sheet2.S18] -> 13 | S19: of:=[Sheet2.T18] -> D | T19: of:=[Sheet2.U18] -> R
A20: of:=[Sheet2.B19] -> Stairs | B20: of:=[Sheet2.C19] -> Matt | C20: of:=[Sheet2.D19] -> 50 | D20: of:=[Sheet2.E19] -> 8 | E20: of:=[Sheet2.F19] -> 11 | F20: of:=[Sheet2.G19] -> 7 | G20: of:=[Sheet2.H19] -> 3 | H20: of:=[Sheet2.I19] -> 0 | I20: of:=[Sheet2.J19] -> 1 | J20: of:=[Sheet2.K19] -> 3 | K20: of:=[Sheet2.L19] -> 6 | L20: of:=[Sheet2.M19] -> 2 | M20: of:=[Sheet2.N19] -> 0 | N20: of:=[Sheet2.O19] -> 0 | O20: of:=[Sheet2.P19] -> 0 | P20: of:=[Sheet2.Q19] -> C | Q20: of:=[Sheet2.R19] -> D | R20: of:=[Sheet2.S19] -> 10 | S20: of:=[Sheet2.T19] -> C | T20: of:=[Sheet2.U19] -> L
A21: of:=[Sheet2.B20] -> Davis | B21: of:=[Sheet2.C20] -> Eric | C21: of:=[Sheet2.D20] -> 5 | D21: of:=[Sheet2.E20] -> 0 | E21: of:=[Sheet2.F20] -> 1 | F21: of:=[Sheet2.G20] -> 2 | G21: of:=[Sheet2.H20] -> 1 | H21: of:=[Sheet2.I20] -> 0 | I21: of:=[Sheet2.J20] -> 0 | J21: of:=[Sheet2.K20] -> 1 | K21: of:=[Sheet2.L20] -> 3 | L21: of:=[Sheet2.M20] -> 0 | M21: of:=[Sheet2.N20] -> 0 | N21: of:=[Sheet2.O20] -> 1 | O21: of:=[Sheet2.P20] -> 0 | P21: of:=[Sheet2.Q20] -> D | Q21: of:=[Sheet2.R20] -> B | R21: of:=[Sheet2.S20] -> 14 | S21: of:=[Sheet2.T20] -> D | T21: of:=[Sheet2.U20] -> R
A22: of:=[Sheet2.B21] -> Mashore | B22: of:=[Sheet2.C21] -> Damon | C22: of:=[Sheet2.D21] -> 58 | D22: of:=[Sheet2.E21] -> 6 | E22: of:=[Sheet2.F21] -> 11 | F22: of:=[Sheet2.G21] -> 4 | G22: of:=[Sheet2.H21] -> 2 | H22: of:=[Sheet2.I21] -> 0 | I22: of:=[Sheet2.J21] -> 1 | J22: of:=[Sheet2.K21] -> 10 | K22: of:=[Sheet2.L21] -> 17 | L22: of:=[Sheet2.M21] -> 0 | M22: of:=[Sheet2.N21] -> 0 | N22: of:=[Sheet2.O21] -> 1 | O22: of:=[Sheet2.P21] -> 0 | P22: of:=[Sheet2.Q21] -> B | Q22: of:=[Sheet2.R21] -> C | R22: of:=[Sheet2.S21] -> 14 | S22: of:=[Sheet2.T21] -> C | T22: of:=[Sheet2.U21] -> R
A23: of:=[Sheet2.B22] -> Hoiles | B23: of:=[Sheet2.C22] -> Chris | C23: of:=[Sheet2.D22] -> 50 | D23: of:=[Sheet2.E22] -> 6 | E23: of:=[Sheet2.F22] -> 9 | F23: of:=[Sheet2.G22] -> 7 | G23: of:=[Sheet2.H22] -> 3 | H23: of:=[Sheet2.I22] -> 0 | I23: of:=[Sheet2.J22] -> 3 | J23: of:=[Sheet2.K22] -> 10 | K23: of:=[Sheet2.L22] -> 17 | L23: of:=[Sheet2.M22] -> 1 | M23: of:=[Sheet2.N22] -> 0 | N23: of:=[Sheet2.O22] -> 0 | O23: of:=[Sheet2.P22] -> 0 | P23: of:=[Sheet2.Q22] -> D | Q23: of:=[Sheet2.R22] -> E | R23: of:=[Sheet2.S22] -> 9 | S23: of:=[Sheet2.T22] -> D | T23: of:=[Sheet2.U22] -> R
A24: of:=[Sheet2.B23] -> Mayne | B24: of:=[Sheet2.C23] -> Brent | C24: of:=[Sheet2.D23] -> 30 | D24: of:=[Sheet2.E23] -> 2 | E24: of:=[Sheet2.F23] -> 5 | F24: of:=[Sheet2.G23] -> 2 | G24: of:=[Sheet2.H23] -> 1 | H24: of:=[Sheet2.I23] -> 0 | I24: of:=[Sheet2.J23] -> 1 | J24: of:=[Sheet2.K23] -> 0 | K24: of:=[Sheet2.L23] -> 4 | L24: of:=[Sheet2.M23] -> 1 | M24: of:=[Sheet2.N23] -> 0 | N24: of:=[Sheet2.O23] -> 0 | O24: of:=[Sheet2.P23] -> 0 | P24: of:=[Sheet2.Q23] -> C | Q24: of:=[Sheet2.R23] -> E | R24: of:=[Sheet2.S23] -> 9 | S24: of:=[Sheet2.T23] -> C | T24: of:=[Sheet2.U23] -> L
A25: of:=[Sheet2.B24] -> Bellhorn | B25: of:=[Sheet2.C24] -> Mark | C25: of:=[Sheet2.D24] -> 6 | D25: of:=[Sheet2.E24] -> 0 | E25: of:=[Sheet2.F24] -> 1 | F25: of:=[Sheet2.G24] -> 0 | G25: of:=[Sheet2.H24] -> 0 | H25: of:=[Sheet2.I24] -> 0 | I25: of:=[Sheet2.J24] -> 0 | J25: of:=[Sheet2.K24] -> 1 | K25: of:=[Sheet2.L24] -> 2 | L25: of:=[Sheet2.M24] -> 0 | M25: of:=[Sheet2.N24] -> 0 | N25: of:=[Sheet2.O24] -> 0 | O25: of:=[Sheet2.P24] -> 0 | P25: of:=[Sheet2.Q24] -> B | Q25: of:=[Sheet2.R24] -> B | R25: of:=[Sheet2.S24] -> 13 | S25: of:=[Sheet2.T24] -> D | T25: of:=[Sheet2.U24] -> S
A26: of:=[Sheet2.B25] -> Reboulet | B26: of:=[Sheet2.C25] -> Jeff | C26: of:=[Sheet2.D25] -> 0 | D26: of:=[Sheet2.E25] -> 0 | E26: of:=[Sheet2.F25] -> 0 | F26: of:=[Sheet2.G25] -> 0 | G26: of:=[Sheet2.H25] -> 0 | H26: of:=[Sheet2.I25] -> 0 | I26: of:=[Sheet2.J25] -> 0 | J26: of:=[Sheet2.K25] -> 0 | K26: of:=[Sheet2.L25] -> 0 | L26: of:=[Sheet2.M25] -> 0 | M26: of:=[Sheet2.N25] -> 0 | N26: of:=[Sheet2.O25] -> 0 | O26: of:=[Sheet2.P25] -> 0 | P26: of:=[Sheet2.Q25] -> A | Q26: of:=[Sheet2.R25] -> C | R26: of:=[Sheet2.S25] -> 12 | S26: of:=[Sheet2.T25] -> C | T26: of:=[Sheet2.U25] -> R
A27: of:=[Sheet2.B26] -> Canseco | B27: of:=[Sheet2.C26] -> Jose | C27: of:=[Sheet2.D26] -> 0 | D27: of:=[Sheet2.E26] -> 0 | E27: of:=[Sheet2.F26] -> 0 | F27: of:=[Sheet2.G26] -> 0 | G27: of:=[Sheet2.H26] -> 0 | H27: of:=[Sheet2.I26] -> 0 | I27: of:=[Sheet2.J26] -> 0 | J27: of:=[Sheet2.K26] -> 0 | K27: of:=[Sheet2.L26] -> 0 | L27: of:=[Sheet2.M26] -> 0 | M27: of:=[Sheet2.N26] -> 0 | N27: of:=[Sheet2.O26] -> 0 | O27: of:=[Sheet2.P26] -> 0 | P27: of:=[Sheet2.Q26] -> D | Q27: of:=[Sheet2.R26] -> C | R27: of:=[Sheet2.S26] -> 10 | S27: of:=[Sheet2.T26] -> D | T27: of:=[Sheet2.U26] -> R
A29: Pitcher | C29: IP | D29: ER | E29: HITS | F29: W | G29: K | H29: HR | I29: Starts | J29: Win | K29: Loss | L29: Sav | M29: ChL | N29: ChR | O29: ERA | P29: TRG | Q29: STAR | R29: REL | S29: Throws
A30: of:=[Sheet3.B2] -> Rhodes | B30: of:=[Sheet3.C2] -> Arthur | C30: of:=[Sheet3.D2] -> 3.6 | D30: of:=[Sheet3.E2] -> 0 | E30: of:=[Sheet3.F2] -> 0 | F30: of:=[Sheet3.G2] -> 0 | G30: of:=[Sheet3.H2] -> 2 | H30: of:=[Sheet3.I2] -> 0 | I30: of:=[Sheet3.J2] -> 2 | J30: of:=[Sheet3.K2] -> 0 | K30: of:=[Sheet3.L2] -> 0 | L30: of:=[Sheet3.M2] -> 1 | M30: of:=[Sheet3.N2] -> 0 | N30: of:=[Sheet3.O2] -> 3 | O30: of:=[Sheet3.P2] -> L | P30: of:=[Sheet3.Q2] -> 16.75 | Q30: of:=[Sheet3.R2] -> 14.95 | R30: of:=[Sheet3.S2] -> 18.25 | S30: of:=[Sheet3.T2] -> 0
A31: of:=[Sheet3.B3] -> Myers | B31: of:=[Sheet3.C3] -> Randy | C31: of:=[Sheet3.D3] -> 3.3 | D31: of:=[Sheet3.E3] -> 0 | E31: of:=[Sheet3.F3] -> 1 | F31: of:=[Sheet3.G3] -> 1 | G31: of:=[Sheet3.H3] -> 3 | H31: of:=[Sheet3.I3] -> 0 | I31: of:=[Sheet3.J3] -> -6 | J31: of:=[Sheet3.K3] -> 1 | K31: of:=[Sheet3.L3] -> 0 | L31: of:=[Sheet3.M3] -> 0 | M31: of:=[Sheet3.N3] -> 0 | N31: of:=[Sheet3.O3] -> 1 | O31: of:=[Sheet3.P3] -> L | P31: of:=[Sheet3.Q3] -> 21.3 | Q31: of:=[Sheet3.R3] -> 28.4 | R31: of:=[Sheet3.S3] -> 18.9 | S31: of:=[Sheet3.T3] -> 0
A32: of:=[Sheet3.B4] -> Kamieniecki | B32: of:=[Sheet3.C4] -> Scott | C32: of:=[Sheet3.D4] -> 32 | D32: of:=[Sheet3.E4] -> 10 | E32: of:=[Sheet3.F4] -> 27 | F32: of:=[Sheet3.G4] -> 8 | G32: of:=[Sheet3.H4] -> 23 | H32: of:=[Sheet3.I4] -> 3 | I32: of:=[Sheet3.J4] -> 2 | J32: of:=[Sheet3.K4] -> 3 | K32: of:=[Sheet3.L4] -> 1 | L32: of:=[Sheet3.M4] -> 0 | M32: of:=[Sheet3.N4] -> 6 | N32: of:=[Sheet3.O4] -> 0 | O32: of:=[Sheet3.P4] -> R | P32: of:=[Sheet3.Q4] -> 27.8 | Q32: of:=[Sheet3.R4] -> 28.5 | R32: of:=[Sheet3.S4] -> 27.25 | S32: of:=[Sheet3.T4] -> 2.81
A33: of:=[Sheet3.B5] -> Taylor | B33: of:=[Sheet3.C5] -> Billy | C33: of:=[Sheet3.D5] -> 3 | D33: of:=[Sheet3.E5] -> 1 | E33: of:=[Sheet3.F5] -> 3 | F33: of:=[Sheet3.G5] -> 0 | G33: of:=[Sheet3.H5] -> 5 | H33: of:=[Sheet3.I5] -> 0 | I33: of:=[Sheet3.J5] -> 5 | J33: of:=[Sheet3.K5] -> 0 | K33: of:=[Sheet3.L5] -> 0 | L33: of:=[Sheet3.M5] -> 1 | M33: of:=[Sheet3.N5] -> 0 | N33: of:=[Sheet3.O5] -> 1 | O33: of:=[Sheet3.P5] -> R | P33: of:=[Sheet3.Q5] -> 26.5 | Q33: of:=[Sheet3.R5] -> 35.6 | R33: of:=[Sheet3.S5] -> 17.55 | S33: of:=[Sheet3.T5] -> 3
A34: of:=[Sheet3.B6] -> Rigby | B34: of:=[Sheet3.C6] -> Brad | C34: of:=[Sheet3.D6] -> 20.3 | D34: of:=[Sheet3.E6] -> 8 | E34: of:=[Sheet3.F6] -> 27 | F34: of:=[Sheet3.G6] -> 4 | G34: of:=[Sheet3.H6] -> 7 | H34: of:=[Sheet3.I6] -> 3 | I34: of:=[Sheet3.J6] -> -6 | J34: of:=[Sheet3.K6] -> 1 | K34: of:=[Sheet3.L6] -> 1 | L34: of:=[Sheet3.M6] -> 0 | M34: of:=[Sheet3.N6] -> 5 | N34: of:=[Sheet3.O6] -> 0 | O34: of:=[Sheet3.P6] -> R | P34: of:=[Sheet3.Q6] -> 31.75 | Q34: of:=[Sheet3.R6] -> 36 | R34: of:=[Sheet3.S6] -> 27.75 | S34: of:=[Sheet3.T6] -> 3.55
A35: of:=[Sheet3.B7] -> Erickson | B35: of:=[Sheet3.C7] -> Scott | C35: of:=[Sheet3.D7] -> 25.3 | D35: of:=[Sheet3.E7] -> 11 | E35: of:=[Sheet3.F7] -> 26 | F35: of:=[Sheet3.G7] -> 10 | G35: of:=[Sheet3.H7] -> 17 | H35: of:=[Sheet3.I7] -> 4 | I35: of:=[Sheet3.J7] -> 1 | J35: of:=[Sheet3.K7] -> 1 | K35: of:=[Sheet3.L7] -> 1 | L35: of:=[Sheet3.M7] -> 0 | M35: of:=[Sheet3.N7] -> 7 | N35: of:=[Sheet3.O7] -> 0 | O35: of:=[Sheet3.P7] -> R | P35: of:=[Sheet3.Q7] -> 25.3 | Q35: of:=[Sheet3.R7] -> 23.2 | R35: of:=[Sheet3.S7] -> 28.2 | S35: of:=[Sheet3.T7] -> 3.91
A36: of:=[Sheet3.B8] -> Karsay | B36: of:=[Sheet3.C8] -> Steve | C36: of:=[Sheet3.D8] -> 23.3 | D36: of:=[Sheet3.E8] -> 11 | E36: of:=[Sheet3.F8] -> 19 | F36: of:=[Sheet3.G8] -> 7 | G36: of:=[Sheet3.H8] -> 15 | H36: of:=[Sheet3.I8] -> 1 | I36: of:=[Sheet3.J8] -> 3 | J36: of:=[Sheet3.K8] -> 1 | K36: of:=[Sheet3.L8] -> 1 | L36: of:=[Sheet3.M8] -> 0 | M36: of:=[Sheet3.N8] -> 6 | N36: of:=[Sheet3.O8] -> 0 | O36: of:=[Sheet3.P8] -> R | P36: of:=[Sheet3.Q8] -> 33.8 | Q36: of:=[Sheet3.R8] -> 32.6 | R36: of:=[Sheet3.S8] -> 33.8 | S36: of:=[Sheet3.T8] -> 4.25
A37: of:=[Sheet3.B9] -> Johnson | B37: of:=[Sheet3.C9] -> Dane | C37: of:=[Sheet3.D9] -> 6 | D37: of:=[Sheet3.E9] -> 3 | E37: of:=[Sheet3.F9] -> 5 | F37: of:=[Sheet3.G9] -> 1 | G37: of:=[Sheet3.H9] -> 6 | H37: of:=[Sheet3.I9] -> 0 | I37: of:=[Sheet3.J9] -> 5 | J37: of:=[Sheet3.K9] -> 1 | K37: of:=[Sheet3.L9] -> 0 | L37: of:=[Sheet3.M9] -> 0 | M37: of:=[Sheet3.N9] -> 0 | N37: of:=[Sheet3.O9] -> 2 | O37: of:=[Sheet3.P9] -> R | P37: of:=[Sheet3.Q9] -> 30 | Q37: of:=[Sheet3.R9] -> 39.2 | R37: of:=[Sheet3.S9] -> 33 | S37: of:=[Sheet3.T9] -> 4.5
A38: of:=[Sheet3.B10] -> Wengert | B38: of:=[Sheet3.C10] -> Don | C38: of:=[Sheet3.D10] -> 2 | D38: of:=[Sheet3.E10] -> 1 | E38: of:=[Sheet3.F10] -> 3 | F38: of:=[Sheet3.G10] -> 0 | G38: of:=[Sheet3.H10] -> 4 | H38: of:=[Sheet3.I10] -> 1 | I38: of:=[Sheet3.J10] -> -4 | J38: of:=[Sheet3.K10] -> 0 | K38: of:=[Sheet3.L10] -> 0 | L38: of:=[Sheet3.M10] -> 0 | M38: of:=[Sheet3.N10] -> 5 | N38: of:=[Sheet3.O10] -> 3 | O38: of:=[Sheet3.P10] -> R | P38: of:=[Sheet3.Q10] -> 35.6 | Q38: of:=[Sheet3.R10] -> 36.3 | R38: of:=[Sheet3.S10] -> 34.5 | S38: of:=[Sheet3.T10] -> 4.5
A39: of:=[Sheet3.B11] -> Benitez | B39: of:=[Sheet3.C11] -> Armando | C39: of:=[Sheet3.D11] -> 2 | D39: of:=[Sheet3.E11] -> 1 | E39: of:=[Sheet3.F11] -> 0 | F39: of:=[Sheet3.G11] -> 3 | G39: of:=[Sheet3.H11] -> 2 | H39: of:=[Sheet3.I11] -> 0 | I39: of:=[Sheet3.J11] -> 9 | J39: of:=[Sheet3.K11] -> 0 | K39: of:=[Sheet3.L11] -> 1 | L39: of:=[Sheet3.M11] -> 0 | M39: of:=[Sheet3.N11] -> 0 | N39: of:=[Sheet3.O11] -> 1 | O39: of:=[Sheet3.P11] -> R | P39: of:=[Sheet3.Q11] -> 20.25 | Q39: of:=[Sheet3.R11] -> 26.25 | R39: of:=[Sheet3.S11] -> 22.35 | S39: of:=[Sheet3.T11] -> 4.5
A40: of:=[Sheet3.B12] -> Small | B40: of:=[Sheet3.C12] -> Aaron | C40: of:=[Sheet3.D12] -> 1.6 | D40: of:=[Sheet3.E12] -> 1 | E40: of:=[Sheet3.F12] -> 1 | F40: of:=[Sheet3.G12] -> 2 | G40: of:=[Sheet3.H12] -> 1 | H40: of:=[Sheet3.I12] -> 0 | I40: of:=[Sheet3.J12] -> 2 | J40: of:=[Sheet3.K12] -> 0 | K40: of:=[Sheet3.L12] -> 0 | L40: of:=[Sheet3.M12] -> 0 | M40: of:=[Sheet3.N12] -> 0 | N40: of:=[Sheet3.O12] -> 2 | O40: of:=[Sheet3.P12] -> R | P40: of:=[Sheet3.Q12] -> 33.5 | Q40: of:=[Sheet3.R12] -> 36.4 | R40: of:=[Sheet3.S12] -> 30.4 | S40: of:=[Sheet3.T12] -> 5.63
A41: of:=[Sheet3.B13] -> Mussina | B41: of:=[Sheet3.C13] -> Mike | C41: of:=[Sheet3.D13] -> 30.3 | D41: of:=[Sheet3.E13] -> 19 | E41: of:=[Sheet3.F13] -> 35 | F41: of:=[Sheet3.G13] -> 10 | G41: of:=[Sheet3.H13] -> 28 | H41: of:=[Sheet3.I13] -> 5 | I41: of:=[Sheet3.J13] -> -4 | J41: of:=[Sheet3.K13] -> 2 | K41: of:=[Sheet3.L13] -> 2 | L41: of:=[Sheet3.M13] -> 0 | M41: of:=[Sheet3.N13] -> 7 | N41: of:=[Sheet3.O13] -> 0 | O41: of:=[Sheet3.P13] -> R | P41: of:=[Sheet3.Q13] -> 20.4 | Q41: of:=[Sheet3.R13] -> 17.5 | R41: of:=[Sheet3.S13] -> 19.5 | S41: of:=[Sheet3.T13] -> 5.64
A42: of:=[Sheet3.B14] -> Key | B42: of:=[Sheet3.C14] -> Jimmy | C42: of:=[Sheet3.D14] -> 25.3 | D42: of:=[Sheet3.E14] -> 17 | E42: of:=[Sheet3.F14] -> 29 | F42: of:=[Sheet3.G14] -> 12 | G42: of:=[Sheet3.H14] -> 13 | H42: of:=[Sheet3.I14] -> 1 | I42: of:=[Sheet3.J14] -> -5 | J42: of:=[Sheet3.K14] -> 2 | K42: of:=[Sheet3.L14] -> 2 | L42: of:=[Sheet3.M14] -> 0 | M42: of:=[Sheet3.N14] -> 6 | N42: of:=[Sheet3.O14] -> 0 | O42: of:=[Sheet3.P14] -> L | P42: of:=[Sheet3.Q14] -> 27 | Q42: of:=[Sheet3.R14] -> 32.6 | R42: of:=[Sheet3.S14] -> 26.7 | S42: of:=[Sheet3.T14] -> 6.05
A43: of:=[Sheet3.B15] -> Orosco | B43: of:=[Sheet3.C15] -> Jesse | C43: of:=[Sheet3.D15] -> 2 | D43: of:=[Sheet3.E15] -> 2 | E43: of:=[Sheet3.F15] -> 2 | F43: of:=[Sheet3.G15] -> 2 | G43: of:=[Sheet3.H15] -> 1 | H43: of:=[Sheet3.I15] -> 0 | I43: of:=[Sheet3.J15] -> -2 | J43: of:=[Sheet3.K15] -> 0 | K43: of:=[Sheet3.L15] -> 0 | L43: of:=[Sheet3.M15] -> 0 | M43: of:=[Sheet3.N15] -> 0 | N43: of:=[Sheet3.O15] -> 1 | O43: of:=[Sheet3.P15] -> L | P43: of:=[Sheet3.Q15] -> 26.5 | Q43: of:=[Sheet3.R15] -> 19 | R43: of:=[Sheet3.S15] -> 40.1 | S43: of:=[Sheet3.T15] -> 9
A44: of:=[Sheet3.B16] -> Oquist | B44: of:=[Sheet3.C16] -> Mike | C44: of:=[Sheet3.D16] -> 6.6 | D44: of:=[Sheet3.E16] -> 13 | E44: of:=[Sheet3.F16] -> 15 | F44: of:=[Sheet3.G16] -> 3 | G44: of:=[Sheet3.H16] -> 3 | H44: of:=[Sheet3.I16] -> 4 | I44: of:=[Sheet3.J16] -> -5 | J44: of:=[Sheet3.K16] -> 0 | K44: of:=[Sheet3.L16] -> 0 | L44: of:=[Sheet3.M16] -> 0 | M44: of:=[Sheet3.N16] -> 5 | N44: of:=[Sheet3.O16] -> 4 | O44: of:=[Sheet3.P16] -> R | P44: of:=[Sheet3.Q16] -> 30.75 | Q44: of:=[Sheet3.R16] -> 29.25 | R44: of:=[Sheet3.S16] -> 30.5 | S44: of:=[Sheet3.T16] -> 17.73

Sheet: Sheet2
A1: Team Name | B1: Batter Name | D1: AB | E1: Runs | F1: Hits | G1: RBI | H1: 2B | I1: 3B | J1: HR | K1: W | L1: K | M1: RE | N1: SF | O1: SB | P1: CS | Q1: Bunting | R1: Stealing | S1: Running | T1: Hit Run | U1: LRS | V1: P | W1: C | X1: 1B | Y1: 2B | Z1: SS | AA1: 3B | AB1: LF | AC1: CF | AD1: RF | AE1: ChB | AF1: ChL | AG1: ChR | AH1: AVG | AI1: SLG | AJ1: OBP | AK1: Games | AL1: HBP | AM1: Ch1B | AN1: Ch2B | AO1: Ch3B | AP1: ChHR | AQ1: ChW | AR1: ChDP | AS1: Ch1BL | AT1: Ch2BL | AU1: Ch3BL | AV1: ChHRL | AW1: ChWL | AX1: ChDPL | AY1: Ch1BR | AZ1: Ch2BR | BA1: Ch3BR | BB1: ChHRR | BC1: ChWR | BD1: ChDPR | BE1: ER1 | BF1: ER2 | BG1: ER3 | BH1: ER4 | BI1: ER5 | BJ1: ER6 | BK1: ER7 | BL1: ER8 | BM1: ER9 | BN1: T Rating | BO1: Passball | BP1: Power Left | BQ1: Power Right | BR1: Outfield Arm | BS1: Catcher Arm
A2: 1997 Baltland | B2: Grieve | C2: Ben | D2: 51 | E2: 9 | F2: 22 | G2: 9 | H2: 7 | I2: 0 | J2: 3 | K2: 3 | L2: 16 | M2: 0 | N2: 0 | O2: 0 | P2: 0 | Q2: D | R2: E | S2: 12 | T2: C | U2: L | V2: 0 | W2: 0 | X2: 0 | Y2: 0 | Z2: 0 | AA2: 0 | AB2: 0 | AC2: 0 | AD2: 0 | AE2: 47 | AF2: 50.1 | AG2: 44.3 | AH2: 0.431 | AI2: 0.745 | AJ2: 0.463 | AK2: 12 | AL2: 0 | AM2: 0 | AN2: 0 | AO2: 0 | AP2: 0 | AQ2: 0 | AR2: 0 | AS2: 0 | AT2: 0 | AU2: 0 | AV2: 0 | AW2: 0 | AX2: 0 | AY2: 0 | AZ2: 0 | BA2: 0 | BB2: 0 | BC2: 0 | BD2: 0 | BE2: 0 | BF2: 0 | BG2: 0 | BH2: 0 | BI2: 0 | BJ2: 0 | BK2: 0 | BL2: 0 | BM2: 0 | BN2: 0 | BO2: 0 | BP2: N | BQ2: N | BR2: -6 | BS2: -4
A3: 1997 Baltland | B3: Magadan | C3: Dave | D3: 45 | E3: 8 | F3: 17 | G3: 6 | H3: 2 | I3: 0 | J3: 3 | K3: 6 | L3: 9 | M3: 0 | N3: 0 | O3: 0 | P3: 0 | Q3: C | R3: E | S3: 8 | T3: B | U3: L | V3: 0 | W3: 0 | X3: 4 | Y3: 0 | Z3: 0 | AA3: 4 | AB3: 0 | AC3: 0 | AD3: 0 | AE3: 51.7 | AF3: 34 | AG3: 54 | AH3: 0.378 | AI3: 0.622 | AJ3: 0.451 | AK3: 10 | AL3: 0 | AM3: 0 | AN3: 0 | AO3: 0 | AP3: 0 | AQ3: 0 | AR3: 0 | AS3: 0 | AT3: 0 | AU3: 0 | AV3: 0 | AW3: 0 | AX3: 0 | AY3: 0 | AZ3: 0 | BA3: 0 | BB3: 0 | BC3: 0 | BD3: 0 | BE3: 0 | BF3: 0 | BG3: 0 | BH3: 0 | BI3: 0 | BJ3: 0 | BK3: 0 | BL3: 0 | BM3: 0 | BN3: 0 | BO3: 0 | BP3: N | BQ3: N | BR3: -6 | BS3: -4
A4: 1997 Baltland | B4: Surhoff | C4: B.J. | D4: 8 | E4: 1 | F4: 3 | G4: 1 | H4: 2 | I4: 0 | J4: 0 | K4: 1 | L4: 1 | M4: 0 | N4: 0 | O4: 0 | P4: 0 | Q4: C | R4: E | S4: 12 | T4: C | U4: L | V4: 0 | W4: 0 | X4: 4 | Y4: 0 | Z4: 0 | AA4: 4 | AB4: 3 | AC4: 0 | AD4: 3 | AE4: 33.4 | AF4: 35.5 | AG4: 33.35 | AH4: 0.375 | AI4: 0.625 | AJ4: 0.444 | AK4: 2 | AL4: 0 | AM4: 0 | AN4: 0 | AO4: 0 | AP4: 0 | AQ4: 0 | AR4: 0 | AS4: 0 | AT4: 0 | AU4: 0 | AV4: 0 | AW4: 0 | AX4: 0 | AY4: 0 | AZ4: 0 | BA4: 0 | BB4: 0 | BC4: 0 | BD4: 0 | BE4: 0 | BF4: 0 | BG4: 0 | BH4: 0 | BI4: 0 | BJ4: 0 | BK4: 0 | BL4: 0 | BM4: 0 | BN4: 0 | BO4: 0 | BP4: N | BQ4: N | BR4: -6 | BS4: -4
A5: 1997 Baltland | B5: Ledesma | C5: Aaron | D5: 57 | E5: 10 | F5: 21 | G5: 8 | H5: 2 | I5: 1 | J5: 2 | K5: 7 | L5: 8 | M5: 3 | N5: 0 | O5: 0 | P5: 0 | Q5: D | R5: D | S5: 12 | T5: C | U5: R | V5: 0 | W5: 0 | X5: 4 | Y5: 3 | Z5: 4 | AA5: 4 | AB5: 0 | AC5: 0 | AD5: 0 | AE5: 46.2 | AF5: 57.1 | AG5: 59.75 | AH5: 0.368 | AI5: 0.544 | AJ5: 0.463 | AK5: 14 | AL5: 0 | AM5: 0 | AN5: 0 | AO5: 0 | AP5: 0 | AQ5: 0 | AR5: 0 | AS5: 0 | AT5: 0 | AU5: 0 | AV5: 0 | AW5: 0 | AX5: 0 | AY5: 0 | AZ5: 0 | BA5: 0 | BB5: 0 | BC5: 0 | BD5: 0 | BE5: 0 | BF5: 0 | BG5: 0 | BH5: 0 | BI5: 0 | BJ5: 0 | BK5: 0 | BL5: 0 | BM5: 0 | BN5: 0 | BO5: 0 | BP5: N | BQ5: N | BR5: -6 | BS5: -4
A6: 1997 Baltland | B6: Baines | C6: Harold | D6: 22 | E6: 2 | F6: 8 | G6: 2 | H6: 2 | I6: 0 | J6: 1 | K6: 4 | L6: 2 | M6: 0 | N6: 0 | O6: 0 | P6: 0 | Q6: D | R6: E | S6: 8 | T6: C | U6: L | V6: 0 | W6: 0 | X6: 0 | Y6: 0 | Z6: 0 | AA6: 0 | AB6: 0 | AC6: 0 | AD6: 0 | AE6: 41.2 | AF6: 28.7 | AG6: 42.55 | AH6: 0.364 | AI6: 0.591 | AJ6: 0.462 | AK6: 6 | AL6: 0 | AM6: 0 | AN6: 0 | AO6: 0 | AP6: 0 | AQ6: 0 | AR6: 0 | AS6: 0 | AT6: 0 | AU6: 0 | AV6: 0 | AW6: 0 | AX6: 0 | AY6: 0 | AZ6: 0 | BA6: 0 | BB6: 0 | BC6: 0 | BD6: 0 | BE6: 0 | BF6: 0 | BG6: 0 | BH6: 0 | BI6: 0 | BJ6: 0 | BK6: 0 | BL6: 0 | BM6: 0 | BN6: 0 | BO6: 0 | BP6: N | BQ6: N | BR6: -6 | BS6: -4
A7: 1997 Baltland | B7: Palmerio | C7: Rafael | D7: 12 | E7: 3 | F7: 4 | G7: 2 | H7: 1 | I7: 0 | J7: 1 | K7: 0 | L7: 4 | M7: 0 | N7: 0 | O7: 0 | P7: 0 | Q7: D | R7: D | S7: 12 | T7: C | U7: L | V7: 0 | W7: 0 | X7: 2 | Y7: 0 | Z7: 0 | AA7: 0 | AB7: 0 | AC7: 0 | AD7: 0 | AE7: 32.1 | AF7: 21.95 | AG7: 38.95 | AH7: 0.333 | AI7: 0.667 | AJ7: 0.333 | AK7: 3 | AL7: 0 | AM7: 0 | AN7: 0 | AO7: 0 | AP7: 0 | AQ7: 0 | AR7: 0 | AS7: 0 | AT7: 0 | AU7: 0 | AV7: 0 | AW7: 0 | AX7: 0 | AY7: 0 | AZ7: 0 | BA7: 0 | BB7: 0 | BC7: 0 | BD7: 0 | BE7: 0 | BF7: 0 | BG7: 0 | BH7: 0 | BI7: 0 | BJ7: 0 | BK7: 0 | BL7: 0 | BM7: 0 | BN7: 0 | BO7: 0 | BP7: N | BQ7: N | BR7: -6 | BS7: -4
A8: 1997 Baltland | B8: Walton | C8: Jerome | D8: 37 | E8: 4 | F8: 11 | G8: 6 | H8: 1 | I8: 0 | J8: 0 | K8: 1 | L8: 5 | M8: 1 | N8: 0 | O8: 0 | P8: 0 | Q8: C | R8: E | S8: 12 | T8: C | U8: R | V8: 0 | W8: 0 | X8: 4 | Y8: 0 | Z8: 0 | AA8: 0 | AB8: 3 | AC8: 3 | AD8: 3 | AE8: 34.8 | AF8: 29.85 | AG8: 43.25 | AH8: 0.297 | AI8: 0.324 | AJ8: 0.333 | AK8: 10 | AL8: 0 | AM8: 0 | AN8: 0 | AO8: 0 | AP8: 0 | AQ8: 0 | AR8: 0 | AS8: 0 | AT8: 0 | AU8: 0 | AV8: 0 | AW8: 0 | AX8: 0 | AY8: 0 | AZ8: 0 | BA8: 0 | BB8: 0 | BC8: 0 | BD8: 0 | BE8: 0 | BF8: 0 | BG8: 0 | BH8: 0 | BI8: 0 | BJ8: 0 | BK8: 0 | BL8: 0 | BM8: 0 | BN8: 0 | BO8: 0 | BP8: N | BQ8: N | BR8: -6 | BS8: -4
A9: 1997 Baltland | B9: Bournigal | C9: Rafael | D9: 28 | E9: 2 | F9: 8 | G9: 9 | H9: 3 | I9: 0 | J9: 1 | K9: 6 | L9: 4 | M9: 1 | N9: 0 | O9: 0 | P9: 0 | Q9: A | R9: D | S9: 13 | T9: B | U9: R | V9: 0 | W9: 0 | X9: 0 | Y9: 2 | Z9: 3 | AA9: 0 | AB9: 0 | AC9: 0 | AD9: 0 | AE9: 32.8 | AF9: 27.5 | AG9: 41.2 | AH9: 0.286 | AI9: 0.5 | AJ9: 0.429 | AK9: 8 | AL9: 0 | AM9: 0 | AN9: 0 | AO9: 0 | AP9: 0 | AQ9: 0 | AR9: 0 | AS9: 0 | AT9: 0 | AU9: 0 | AV9: 0 | AW9: 0 | AX9: 0 | AY9: 0 | AZ9: 0 | BA9: 0 | BB9: 0 | BC9: 0 | BD9: 0 | BE9: 0 | BF9: 0 | BG9: 0 | BH9: 0 | BI9: 0 | BJ9: 0 | BK9: 0 | BL9: 0 | BM9: 0 | BN9: 0 | BO9: 0 | BP9: N | BQ9: N | BR9: -6 | BS9: -4
A10: 1997 Baltland | B10: Williams | C10: George | D10: 55 | E10: 12 | F10: 15 | G10: 9 | H10: 0 | I10: 0 | J10: 4 | K10: 6 | L10: 14 | M10: 1 | N10: 0 | O10: 0 | P10: 0 | Q10: C | R10: E | S10: 10 | T10: C | U10: S | V10: 0 | W10: 4 | X10: 0 | Y10: 0 | Z10: 0 | AA10: 0 | AB10: 0 | AC10: 0 | AD10: 0 | AE10: 48.5 | AF10: 48.1 | AG10: 48.7 | AH10: 0.273 | AI10: 0.491 | AJ10: 0.355 | AK10: 14 | AL10: 0 | AM10: 0 | AN10: 0 | AO10: 0 | AP10: 0 | AQ10: 0 | AR10: 0 | AS10: 0 | AT10: 0 | AU10: 0 | AV10: 0 | AW10: 0 | AX10: 0 | AY10: 0 | AZ10: 0 | BA10: 0 | BB10: 0 | BC10: 0 | BD10: 0 | BE10: 0 | BF10: 0 | BG10: 0 | BH10: 0 | BI10: 0 | BJ10: 0 | BK10: 0 | BL10: 0 | BM10: 0 | BN10: 0 | BO10: 0 | BP10: N | BQ10: N | BR10: -6 | BS10: -4
A11: 1997 Baltland | B11: Ripken | C11: Cal | D11: 38 | E11: 5 | F11: 10 | G11: 3 | H11: 1 | I11: 0 | J11: 3 | K11: 6 | L11: 5 | M11: 0 | N11: 0 | O11: 0 | P11: 0 | Q11: D | R11: E | S11: 10 | T11: B | U11: R | V11: 0 | W11: 0 | X11: 0 | Y11: 0 | Z11: 3 | AA11: 3 | AB11: 0 | AC11: 0 | AD11: 0 | AE11: 33.8 | AF11: 33.4 | AG11: 37.4 | AH11: 0.263 | AI11: 0.526 | AJ11: 0.364 | AK11: 11 | AL11: 0 | AM11: 0 | AN11: 0 | AO11: 0 | AP11: 0 | AQ11: 0 | AR11: 0 | AS11: 0 | AT11: 0 | AU11: 0 | AV11: 0 | AW11: 0 | AX11: 0 | AY11: 0 | AZ11: 0 | BA11: 0 | BB11: 0 | BC11: 0 | BD11: 0 | BE11: 0 | BF11: 0 | BG11: 0 | BH11: 0 | BI11: 0 | BJ11: 0 | BK11: 0 | BL11: 0 | BM11: 0 | BN11: 0 | BO11: 0 | BP11: N | BQ11: N | BR11: -6 | BS11: -4
A12: 1997 Baltland | B12: Alomar | C12: Roberto | D12: 54 | E12: 11 | F12: 14 | G12: 9 | H12: 1 | I12: 0 | J12: 4 | K12: 4 | L12: 6 | M12: 1 | N12: 0 | O12: 0 | P12: 0 | Q12: A | R12: B | S12: 15 | T12: B | U12: S | V12: 0 | W12: 0 | X12: 0 | Y12: 1 | Z12: 0 | AA12: 0 | AB12: 0 | AC12: 0 | AD12: 0 | AE12: 47 | AF12: 30.5 | AG12: 53.55 | AH12: 0.259 | AI12: 0.5 | AJ12: 0.322 | AK12: 13 | AL12: 0 | AM12: 0 | AN12: 0 | AO12: 0 | AP12: 0 | AQ12: 0 | AR12: 0 | AS12: 0 | AT12: 0 | AU12: 0 | AV12: 0 | AW12: 0 | AX12: 0 | AY12: 0 | AZ12: 0 | BA12: 0 | BB12: 0 | BC12: 0 | BD12: 0 | BE12: 0 | BF12: 0 | BG12: 0 | BH12: 0 | BI12: 0 | BJ12: 0 | BK12: 0 | BL12: 0 | BM12: 0 | BN12: 0 | BO12: 0 | BP12: N | BQ12: N | BR12: -6 | BS12: -4
A13: 1997 Baltland | B13: Giambi | C13: Jason | D13: 28 | E13: 2 | F13: 7 | G13: 7 | H13: 0 | I13: 1 | J13: 1 | K13: 1 | L13: 8 | M13: 0 | N13: 0 | O13: 0 | P13: 0 | Q13: D | R13: E | S13: 11 | T13: C | U13: L | V13: 0 | W13: 0 | X13: 3 | Y13: 0 | Z13: 0 | AA13: 0 | AB13: 5 | AC13: 0 | AD13: 5 | AE13: 39.8 | AF13: 46 | AG13: 38.4 | AH13: 0.25 | AI13: 0.429 | AJ13: 0.276 | AK13: 8 | AL13: 0 | AM13: 0 | AN13: 0 | AO13: 0 | AP13: 0 | AQ13: 0 | AR13: 0 | AS13: 0 | AT13: 0 | AU13: 0 | AV13: 0 | AW13: 0 | AX13: 0 | AY13: 0 | AZ13: 0 | BA13: 0 | BB13: 0 | BC13: 0 | BD13: 0 | BE13: 0 | BF13: 0 | BG13: 0 | BH13: 0 | BI13: 0 | BJ13: 0 | BK13: 0 | BL13: 0 | BM13: 0 | BN13: 0 | BO13: 0 | BP13: N | BQ13: N | BR13: -6 | BS13: -4
A14: 1997 Baltland | B14: Hammonds | C14: Jeffrey | D14: 4 | E14: 0 | F14: 1 | G14: 1 | H14: 0 | I14: 0 | J14: 0 | K14: 0 | L14: 1 | M14: 0 | N14: 0 | O14: 0 | P14: 0 | Q14: D | R14: B | S14: 16 | T14: C | U14: R | V14: 0 | W14: 0 | X14: 0 | Y14: 0 | Z14: 0 | AA14: 0 | AB14: 3 | AC14: 3 | AD14: 3 | AE14: 31 | AF14: 36.05 | AG14: 32.7 | AH14: 0.25 | AI14: 0.25 | AJ14: 0.25 | AK14: 1 | AL14: 0 | AM14: 0 | AN14: 0 | AO14: 0 | AP14: 0 | AQ14: 0 | AR14: 0 | AS14: 0 | AT14: 0 | AU14: 0 | AV14: 0 | AW14: 0 | AX14: 0 | AY14: 0 | AZ14: 0 | BA14: 0 | BB14: 0 | BC14: 0 | BD14: 0 | BE14: 0 | BF14: 0 | BG14: 0 | BH14: 0 | BI14: 0 | BJ14: 0 | BK14: 0 | BL14: 0 | BM14: 0 | BN14: 0 | BO14: 0 | BP14: N | BQ14: N | BR14: -6 | BS14: -4
A15: 1997 Baltland | B15: Anderson | C15: Brady | D15: 37 | E15: 7 | F15: 9 | G15: 3 | H15: 2 | I15: 1 | J15: 0 | K15: 5 | L15: 4 | M15: 2 | N15: 0 | O15: 3 | P15: 1 | Q15: C | R15: B | S15: 16 | T15: C | U15: L | V15: 0 | W15: 0 | X15: 0 | Y15: 0 | Z15: 0 | AA15: 0 | AB15: 0 | AC15: 1 | AD15: 0 | AE15: 43 | AF15: 44.2 | AG15: 46.4 | AH15: 0.243 | AI15: 0.351 | AJ15: 0.404 | AK15: 9 | AL15: 0 | AM15: 0 | AN15: 0 | AO15: 0 | AP15: 0 | AQ15: 0 | AR15: 0 | AS15: 0 | AT15: 0 | AU15: 0 | AV15: 0 | AW15: 0 | AX15: 0 | AY15: 0 | AZ15: 0 | BA15: 0 | BB15: 0 | BC15: 0 | BD15: 0 | BE15: 0 | BF15: 0 | BG15: 0 | BH15: 0 | BI15: 0 | BJ15: 0 | BK15: 0 | BL15: 0 | BM15: 0 | BN15: 0 | BO15: 0 | BP15: N | BQ15: N | BR15: -6 | BS15: -4
A16: 1997 Baltland | B16: Berroa | C16: Geronimo | D16: 25 | E16: 6 | F16: 6 | G16: 0 | H16: 1 | I16: 0 | J16: 0 | K16: 2 | L16: 4 | M16: 1 | N16: 0 | O16: 1 | P16: 0 | Q16: D | R16: D | S16: 12 | T16: D | U16: R | V16: 0 | W16: 0 | X16: 0 | Y16: 0 | Z16: 0 | AA16: 0 | AB16: 0 | AC16: 0 | AD16: 0 | AE16: 41.4 | AF16: 54.4 | AG16: 41 | AH16: 0.24 | AI16: 0.28 | AJ16: 0.345 | AK16: 6 | AL16: 0 | AM16: 0 | AN16: 0 | AO16: 0 | AP16: 0 | AQ16: 0 | AR16: 0 | AS16: 0 | AT16: 0 | AU16: 0 | AV16: 0 | AW16: 0 | AX16: 0 | AY16: 0 | AZ16: 0 | BA16: 0 | BB16: 0 | BC16: 0 | BD16: 0 | BE16: 0 | BF16: 0 | BG16: 0 | BH16: 0 | BI16: 0 | BJ16: 0 | BK16: 0 | BL16: 0 | BM16: 0 | BN16: 0 | BO16: 0 | BP16: N | BQ16: N | BR16: -6 | BS16: -4
A17: 1997 Baltland | B17: McDonald | C17: Jason | D17: 25 | E17: 1 | F17: 6 | G17: 5 | H17: 1 | I17: 0 | J17: 0 | K17: 6 | L17: 6 | M17: 0 | N17: 0 | O17: 2 | P17: 1 | Q17: B | R17: B | S17: 16 | T17: D | U17: S | V17: 0 | W17: 0 | X17: 0 | Y17: 0 | Z17: 0 | AA17: 0 | AB17: 2 | AC17: 3 | AD17: 2 | AE17: 40.6 | AF17: 48.4 | AG17: 37.35 | AH17: 0.24 | AI17: 0.28 | AJ17: 0.424 | AK17: 7 | AL17: 0 | AM17: 0 | AN17: 0 | AO17: 0 | AP17: 0 | AQ17: 0 | AR17: 0 | AS17: 0 | AT17: 0 | AU17: 0 | AV17: 0 | AW17: 0 | AX17: 0 | AY17: 0 | AZ17: 0 | BA17: 0 | BB17: 0 | BC17: 0 | BD17: 0 | BE17: 0 | BF17: 0 | BG17: 0 | BH17: 0 | BI17: 0 | BJ17: 0 | BK17: 0 | BL17: 0 | BM17: 0 | BN17: 0 | BO17: 0 | BP17: N | BQ17: N | BR17: -6 | BS17: -4
A18: 1997 Baltland | B18: Lennon | C18: Patrick | D18: 18 | E18: 0 | F18: 4 | G18: 0 | H18: 2 | I18: 0 | J18: 0 | K18: 1 | L18: 10 | M18: 0 | N18: 0 | O18: 0 | P18: 0 | Q18: D | R18: E | S18: 13 | T18: D | U18: R | V18: 0 | W18: 0 | X18: 0 | Y18: 0 | Z18: 0 | AA18: 0 | AB18: 3 | AC18: 4 | AD18: 3 | AE18: 44.2 | AF18: 55.5 | AG18: 18.4 | AH18: 0.222 | AI18: 0.333 | AJ18: 0.263 | AK18: 4 | AL18: 0 | AM18: 0 | AN18: 0 | AO18: 0 | AP18: 0 | AQ18: 0 | AR18: 0 | AS18: 0 | AT18: 0 | AU18: 0 | AV18: 0 | AW18: 0 | AX18: 0 | AY18: 0 | AZ18: 0 | BA18: 0 | BB18: 0 | BC18: 0 | BD18: 0 | BE18: 0 | BF18: 0 | BG18: 0 | BH18: 0 | BI18: 0 | BJ18: 0 | BK18: 0 | BL18: 0 | BM18: 0 | BN18: 0 | BO18: 0 | BP18: N | BQ18: N | BR18: -6 | BS18: -4
A19: 1997 Baltland | B19: Stairs | C19: Matt | D19: 50 | E19: 8 | F19: 11 | G19: 7 | H19: 3 | I19: 0 | J19: 1 | K19: 3 | L19: 6 | M19: 2 | N19: 0 | O19: 0 | P19: 0 | Q19: C | R19: D | S19: 10 | T19: C | U19: L | V19: 0 | W19: 0 | X19: 4 | Y19: 0 | Z19: 0 | AA19: 0 | AB19: 4 | AC19: 0 | AD19: 4 | AE19: 45.75 | AF19: 40.35 | AG19: 48 | AH19: 0.22 | AI19: 0.34 | AJ19: 0.291 | AK19: 12 | AL19: 0 | AM19: 0 | AN19: 0 | AO19: 0 | AP19: 0 | AQ19: 0 | AR19: 0 | AS19: 0 | AT19: 0 | AU19: 0 | AV19: 0 | AW19: 0 | AX19: 0 | AY19: 0 | AZ19: 0 | BA19: 0 | BB19: 0 | BC19: 0 | BD19: 0 | BE19: 0 | BF19: 0 | BG19: 0 | BH19: 0 | BI19: 0 | BJ19: 0 | BK19: 0 | BL19: 0 | BM19: 0 | BN19: 0 | BO19: 0 | BP19: N | BQ19: N | BR19: -6 | BS19: -4
A20: 1997 Baltland | B20: Davis | C20: Eric | D20: 5 | E20: 0 | F20: 1 | G20: 2 | H20: 1 | I20: 0 | J20: 0 | K20: 1 | L20: 3 | M20: 0 | N20: 0 | O20: 1 | P20: 0 | Q20: D | R20: B | S20: 14 | T20: D | U20: R | V20: 0 | W20: 0 | X20: 0 | Y20: 0 | Z20: 0 | AA20: 0 | AB20: 0 | AC20: 0 | AD20: 0 | AE20: 40.5 | AF20: 50.1 | AG20: 37.8 | AH20: 0.2 | AI20: 0.4 | AJ20: 0.429 | AK20: 2 | AL20: 0 | AM20: 0 | AN20: 0 | AO20: 0 | AP20: 0 | AQ20: 0 | AR20: 0 | AS20: 0 | AT20: 0 | AU20: 0 | AV20: 0 | AW20: 0 | AX20: 0 | AY20: 0 | AZ20: 0 | BA20: 0 | BB20: 0 | BC20: 0 | BD20: 0 | BE20: 0 | BF20: 0 | BG20: 0 | BH20: 0 | BI20: 0 | BJ20: 0 | BK20: 0 | BL20: 0 | BM20: 0 | BN20: 0 | BO20: 0 | BP20: N | BQ20: N | BR20: -6 | BS20: -4
A21: 1997 Baltland | B21: Mashore | C21: Damon | D21: 58 | E21: 6 | F21: 11 | G21: 4 | H21: 2 | I21: 0 | J21: 1 | K21: 10 | L21: 17 | M21: 0 | N21: 0 | O21: 1 | P21: 0 | Q21: B | R21: C | S21: 14 | T21: C | U21: R | V21: 0 | W21: 0 | X21: 0 | Y21: 0 | Z21: 0 | AA21: 0 | AB21: 2 | AC21: 3 | AD21: 2 | AE21: 40.6 | AF21: 52.05 | AG21: 42.15 | AH21: 0.19 | AI21: 0.276 | AJ21: 0.319 | AK21: 16 | AL21: 0 | AM21: 0 | AN21: 0 | AO21: 0 | AP21: 0 | AQ21: 0 | AR21: 0 | AS21: 0 | AT21: 0 | AU21: 0 | AV21: 0 | AW21: 0 | AX21: 0 | AY21: 0 | AZ21: 0 | BA21: 0 | BB21: 0 | BC21: 0 | BD21: 0 | BE21: 0 | BF21: 0 | BG21: 0 | BH21: 0 | BI21: 0 | BJ21: 0 | BK21: 0 | BL21: 0 | BM21: 0 | BN21: 0 | BO21: 0 | BP21: N | BQ21: N | BR21: -6 | BS21: -4
A22: 1997 Baltland | B22: Hoiles | C22: Chris | D22: 50 | E22: 6 | F22: 9 | G22: 7 | H22: 3 | I22: 0 | J22: 3 | K22: 10 | L22: 17 | M22: 1 | N22: 0 | O22: 0 | P22: 0 | Q22: D | R22: E | S22: 9 | T22: D | U22: R | V22: 0 | W22: 3 | X22: 4 | Y22: 0 | Z22: 0 | AA22: 5 | AB22: 0 | AC22: 0 | AD22: 0 | AE22: 39.8 | AF22: 45.2 | AG22: 44.7 | AH22: 0.18 | AI22: 0.42 | AJ22: 0.328 | AK22: 15 | AL22: 0 | AM22: 0 | AN22: 0 | AO22: 0 | AP22: 0 | AQ22: 0 | AR22: 0 | AS22: 0 | AT22: 0 | AU22: 0 | AV22: 0 | AW22: 0 | AX22: 0 | AY22: 0 | AZ22: 0 | BA22: 0 | BB22: 0 | BC22: 0 | BD22: 0 | BE22: 0 | BF22: 0 | BG22: 0 | BH22: 0 | BI22: 0 | BJ22: 0 | BK22: 0 | BL22: 0 | BM22: 0 | BN22: 0 | BO22: 0 | BP22: N | BQ22: N | BR22: -6 | BS22: -4
A23: 1997 Baltland | B23: Mayne | C23: Brent | D23: 30 | E23: 2 | F23: 5 | G23: 2 | H23: 1 | I23: 0 | J23: 1 | K23: 0 | L23: 4 | M23: 1 | N23: 0 | O23: 0 | P23: 0 | Q23: C | R23: E | S23: 9 | T23: C | U23: L | V23: 0 | W23: 3 | X23: 0 | Y23: 0 | Z23: 0 | AA23: 0 | AB23: 0 | AC23: 0 | AD23: 0 | AE23: 34.6 | AF23: 30.6 | AG23: 36.95 | AH23: 0.167 | AI23: 0.3 | AJ23: 0.194 | AK23: 8 | AL23: 0 | AM23: 0 | AN23: 0 | AO23: 0 | AP23: 0 | AQ23: 0 | AR23: 0 | AS23: 0 | AT23: 0 | AU23: 0 | AV23: 0 | AW23: 0 | AX23: 0 | AY23: 0 | AZ23: 0 | BA23: 0 | BB23: 0 | BC23: 0 | BD23: 0 | BE23: 0 | BF23: 0 | BG23: 0 | BH23: 0 | BI23: 0 | BJ23: 0 | BK23: 0 | BL23: 0 | BM23: 0 | BN23: 0 | BO23: 0 | BP23: N | BQ23: N | BR23: -6 | BS23: -4
A24: 1997 Baltland | B24: Bellhorn | C24: Mark | D24: 6 | E24: 0 | F24: 1 | G24: 0 | H24: 0 | I24: 0 | J24: 0 | K24: 1 | L24: 2 | M24: 0 | N24: 0 | O24: 0 | P24: 0 | Q24: B | R24: B | S24: 13 | T24: D | U24: S | V24: 0 | W24: 0 | X24: 0 | Y24: 4 | Z24: 4 | AA24: 3 | AB24: 0 | AC24: 0 | AD24: 0 | AE24: 33.2 | AF24: 29.95 | AG24: 32.9 | AH24: 0.167 | AI24: 0.167 | AJ24: 0.286 | AK24: 2 | AL24: 0 | AM24: 0 | AN24: 0 | AO24: 0 | AP24: 0 | AQ24: 0 | AR24: 0 | AS24: 0 | AT24: 0 | AU24: 0 | AV24: 0 | AW24: 0 | AX24: 0 | AY24: 0 | AZ24: 0 | BA24: 0 | BB24: 0 | BC24: 0 | BD24: 0 | BE24: 0 | BF24: 0 | BG24: 0 | BH24: 0 | BI24: 0 | BJ24: 0 | BK24: 0 | BL24: 0 | BM24: 0 | BN24: 0 | BO24: 0 | BP24: N | BQ24: N | BR24: -6 | BS24: -4
A25: 1997 Baltland | B25: Reboulet | C25: Jeff | D25: 0 | E25: 0 | F25: 0 | G25: 0 | H25: 0 | I25: 0 | J25: 0 | K25: 0 | L25: 0 | M25: 0 | N25: 0 | O25: 0 | P25: 0 | Q25: A | R25: C | S25: 12 | T25: C | U25: R | V25: 0 | W25: 0 | X25: 0 | Y25: 3 | Z25: 4 | AA25: 3 | AB25: 0 | AC25: 0 | AD25: 0 | AE25: 29.4 | AF25: 24.5 | AG25: 36.2 | AH25: 0 | AI25: 0 | AJ25: 0 | AK25: 0 | AL25: 0 | AM25: 0 | AN25: 0 | AO25: 0 | AP25: 0 | AQ25: 0 | AR25: 0 | AS25: 0 | AT25: 0 | AU25: 0 | AV25: 0 | AW25: 0 | AX25: 0 | AY25: 0 | AZ25: 0 | BA25: 0 | BB25: 0 | BC25: 0 | BD25: 0 | BE25: 0 | BF25: 0 | BG25: 0 | BH25: 0 | BI25: 0 | BJ25: 0 | BK25: 0 | BL25: 0 | BM25: 0 | BN25: 0 | BO25: 0 | BP25: N | BQ25: N | BR25: -6 | BS25: -4
A26: 1997 Baltland | B26: Canseco | C26: Jose | D26: 0 | E26: 0 | F26: 0 | G26: 0 | H26: 0 | I26: 0 | J26: 0 | K26: 0 | L26: 0 | M26: 0 | N26: 0 | O26: 0 | P26: 0 | Q26: D | R26: C | S26: 10 | T26: D | U26: R | V26: 0 | W26: 0 | X26: 0 | Y26: 0 | Z26: 0 | AA26: 0 | AB26: 5 | AC26: 0 | AD26: 5 | AE26: 32.2 | AF26: 33.85 | AG26: 35.8 | AH26: 0 | AI26: 0 | AJ26: 0 | AK26: 0 | AL26: 0 | AM26: 0 | AN26: 0 | AO26: 0 | AP26: 0 | AQ26: 0 | AR26: 0 | AS26: 0 | AT26: 0 | AU26: 0 | AV26: 0 | AW26: 0 | AX26: 0 | AY26: 0 | AZ26: 0 | BA26: 0 | BB26: 0 | BC26: 0 | BD26: 0 | BE26: 0 | BF26: 0 | BG26: 0 | BH26: 0 | BI26: 0 | BJ26: 0 | BK26: 0 | BL26: 0 | BM26: 0 | BN26: 0 | BO26: 0 | BP26: N | BQ26: N | BR26: -6 | BS26: -4

Sheet: Sheet3
A1: Team Name | B1: Pitcher Name | D1: IP | E1: ER | F1: Hits | G1: Walks | H1: Strikeouts | I1: Homeruns | J1: Hold | K1: Wins | L1: Loss | M1: Saves | N1: Starter | O1: Relief | P1: Throws | Q1: ChB | R1: ChL | S1: ChR | T1: ERA | U1: TRG | V1: Starts | W1: Games | X1: Completed Games | Y1: Ch1B | Z1: Ch2B | AA1: Ch3B | AB1: ChHR | AC1: ChW | AD1: ChDP | AE1: Ch1BL | AF1: Ch2BL | AG1: Ch3BL | AH1: ChHRL | AI1: ChWL | AJ1: ChDPL | AK1: Ch1BR | AL1: Ch2BR | AM1: Ch3BR | AN1: ChHRR | AO1: ChWR | AP1: ChDPR | AQ1: Wild Pitch | AR1: Balk | AS1: Fielding | AT1: ErrorRating | AU1: Bunting
A2: 1997 Baltland | B2: Rhodes | C2: Arthur | D2: 3.6 | E2: 0 | F2: 0 | G2: 0 | H2: 2 | I2: 0 | J2: 2 | K2: 0 | L2: 0 | M2: 1 | N2: 0 | O2: 3 | P2: L | Q2: 16.75 | R2: 14.95 | S2: 18.25 | T2: 0 | U2: 0 | V2: 0 | W2: 2 | X2: 0 | Y2: 0 | Z2: 0 | AA2: 0 | AB2: 0 | AC2: 0 | AD2: 0 | AE2: 0 | AF2: 0 | AG2: 0 | AH2: 0 | AI2: 0 | AJ2: 0 | AK2: 0 | AL2: 0 | AM2: 0 | AN2: 0 | AO2: 0 | AP2: 0 | AQ2: 0 | AR2: 0 | AS2: 0 | AT2: 0 | AU2: C
A3: 1997 Baltland | B3: Myers | C3: Randy | D3: 3.3 | E3: 0 | F3: 1 | G3: 1 | H3: 3 | I3: 0 | J3: -6 | K3: 1 | L3: 0 | M3: 0 | N3: 0 | O3: 1 | P3: L | Q3: 21.3 | R3: 28.4 | S3: 18.9 | T3: 0 | U3: 5.45 | V3: 0 | W3: 2 | X3: 0 | Y3: 0 | Z3: 0 | AA3: 0 | AB3: 0 | AC3: 0 | AD3: 0 | AE3: 0 | AF3: 0 | AG3: 0 | AH3: 0 | AI3: 0 | AJ3: 0 | AK3: 0 | AL3: 0 | AM3: 0 | AN3: 0 | AO3: 0 | AP3: 0 | AQ3: 0 | AR3: 0 | AS3: 0 | AT3: 0 | AU3: C
A4: 1997 Baltland | B4: Kamieniecki | C4: Scott | D4: 32 | E4: 10 | F4: 27 | G4: 8 | H4: 23 | I4: 3 | J4: 2 | K4: 3 | L4: 1 | M4: 0 | N4: 6 | O4: 0 | P4: R | Q4: 27.8 | R4: 28.5 | S4: 27.25 | T4: 2.81 | U4: 9.84 | V4: 4 | W4: 4 | X4: 3 | Y4: 0 | Z4: 0 | AA4: 0 | AB4: 0 | AC4: 0 | AD4: 0 | AE4: 0 | AF4: 0 | AG4: 0 | AH4: 0 | AI4: 0 | AJ4: 0 | AK4: 0 | AL4: 0 | AM4: 0 | AN4: 0 | AO4: 0 | AP4: 0 | AQ4: 0 | AR4: 0 | AS4: 0 | AT4: 0 | AU4: D
A5: 1997 Baltland | B5: Taylor | C5: Billy | D5: 3 | E5: 1 | F5: 3 | G5: 0 | H5: 5 | I5: 0 | J5: 5 | K5: 0 | L5: 0 | M5: 1 | N5: 0 | O5: 1 | P5: R | Q5: 26.5 | R5: 35.6 | S5: 17.55 | T5: 3 | U5: 9 | V5: 0 | W5: 1 | X5: 0 | Y5: 0 | Z5: 0 | AA5: 0 | AB5: 0 | AC5: 0 | AD5: 0 | AE5: 0 | AF5: 0 | AG5: 0 | AH5: 0 | AI5: 0 | AJ5: 0 | AK5: 0 | AL5: 0 | AM5: 0 | AN5: 0 | AO5: 0 | AP5: 0 | AQ5: 0 | AR5: 0 | AS5: 0 | AT5: 0 | AU5: C
A6: 1997 Baltland | B6: Rigby | C6: Brad | D6: 20.3 | E6: 8 | F6: 27 | G6: 4 | H6: 7 | I6: 3 | J6: -6 | K6: 1 | L6: 1 | M6: 0 | N6: 5 | O6: 0 | P6: R | Q6: 31.75 | R6: 36 | S6: 27.75 | T6: 3.55 | U6: 13.74 | V6: 3 | W6: 3 | X6: 1 | Y6: 0 | Z6: 0 | AA6: 0 | AB6: 0 | AC6: 0 | AD6: 0 | AE6: 0 | AF6: 0 | AG6: 0 | AH6: 0 | AI6: 0 | AJ6: 0 | AK6: 0 | AL6: 0 | AM6: 0 | AN6: 0 | AO6: 0 | AP6: 0 | AQ6: 0 | AR6: 0 | AS6: 0 | AT6: 0 | AU6: C
A7: 1997 Baltland | B7: Erickson | C7: Scott | D7: 25.3 | E7: 11 | F7: 26 | G7: 10 | H7: 17 | I7: 4 | J7: 1 | K7: 1 | L7: 1 | M7: 0 | N7: 7 | O7: 0 | P7: R | Q7: 25.3 | R7: 23.2 | S7: 28.2 | T7: 3.91 | U7: 12.81 | V7: 3 | W7: 3 | X7: 2 | Y7: 0 | Z7: 0 | AA7: 0 | AB7: 0 | AC7: 0 | AD7: 0 | AE7: 0 | AF7: 0 | AG7: 0 | AH7: 0 | AI7: 0 | AJ7: 0 | AK7: 0 | AL7: 0 | AM7: 0 | AN7: 0 | AO7: 0 | AP7: 0 | AQ7: 0 | AR7: 0 | AS7: 0 | AT7: 0 | AU7: B
A8: 1997 Baltland | B8: Karsay | C8: Steve | D8: 23.3 | E8: 11 | F8: 19 | G8: 7 | H8: 15 | I8: 1 | J8: 3 | K8: 1 | L8: 1 | M8: 0 | N8: 6 | O8: 0 | P8: R | Q8: 33.8 | R8: 32.6 | S8: 33.8 | T8: 4.25 | U8: 10.04 | V8: 3 | W8: 3 | X8: 0 | Y8: 0 | Z8: 0 | AA8: 0 | AB8: 0 | AC8: 0 | AD8: 0 | AE8: 0 | AF8: 0 | AG8: 0 | AH8: 0 | AI8: 0 | AJ8: 0 | AK8: 0 | AL8: 0 | AM8: 0 | AN8: 0 | AO8: 0 | AP8: 0 | AQ8: 0 | AR8: 0 | AS8: 0 | AT8: 0 | AU8: C
A9: 1997 Baltland | B9: Johnson | C9: Dane | D9: 6 | E9: 3 | F9: 5 | G9: 1 | H9: 6 | I9: 0 | J9: 5 | K9: 1 | L9: 0 | M9: 0 | N9: 0 | O9: 2 | P9: R | Q9: 30 | R9: 39.2 | S9: 33 | T9: 4.5 | U9: 9 | V9: 0 | W9: 1 | X9: 0 | Y9: 0 | Z9: 0 | AA9: 0 | AB9: 0 | AC9: 0 | AD9: 0 | AE9: 0 | AF9: 0 | AG9: 0 | AH9: 0 | AI9: 0 | AJ9: 0 | AK9: 0 | AL9: 0 | AM9: 0 | AN9: 0 | AO9: 0 | AP9: 0 | AQ9: 0 | AR9: 0 | AS9: 0 | AT9: 0 | AU9: C
A10: 1997 Baltland | B10: Wengert | C10: Don | D10: 2 | E10: 1 | F10: 3 | G10: 0 | H10: 4 | I10: 1 | J10: -4 | K10: 0 | L10: 0 | M10: 0 | N10: 5 | O10: 3 | P10: R | Q10: 35.6 | R10: 36.3 | S10: 34.5 | T10: 4.5 | U10: 13.5 | V10: 0 | W10: 1 | X10: 0 | Y10: 0 | Z10: 0 | AA10: 0 | AB10: 0 | AC10: 0 | AD10: 0 | AE10: 0 | AF10: 0 | AG10: 0 | AH10: 0 | AI10: 0 | AJ10: 0 | AK10: 0 | AL10: 0 | AM10: 0 | AN10: 0 | AO10: 0 | AP10: 0 | AQ10: 0 | AR10: 0 | AS10: 0 | AT10: 0 | AU10: C
A11: 1997 Baltland | B11: Benitez | C11: Armando | D11: 2 | E11: 1 | F11: 0 | G11: 3 | H11: 2 | I11: 0 | J11: 9 | K11: 0 | L11: 1 | M11: 0 | N11: 0 | O11: 1 | P11: R | Q11: 20.25 | R11: 26.25 | S11: 22.35 | T11: 4.5 | U11: 13.5 | V11: 0 | W11: 1 | X11: 0 | Y11: 0 | Z11: 0 | AA11: 0 | AB11: 0 | AC11: 0 | AD11: 0 | AE11: 0 | AF11: 0 | AG11: 0 | AH11: 0 | AI11: 0 | AJ11: 0 | AK11: 0 | AL11: 0 | AM11: 0 | AN11: 0 | AO11: 0 | AP11: 0 | AQ11: 0 | AR11: 0 | AS11: 0 | AT11: 0 | AU11: C
A12: 1997 Baltland | B12: Small | C12: Aaron | D12: 1.6 | E12: 1 | F12: 1 | G12: 2 | H12: 1 | I12: 0 | J12: 2 | K12: 0 | L12: 0 | M12: 0 | N12: 0 | O12: 2 | P12: R | Q12: 33.5 | R12: 36.4 | S12: 30.4 | T12: 5.63 | U12: 16.88 | V12: 0 | W12: 1 | X12: 0 | Y12: 0 | Z12: 0 | AA12: 0 | AB12: 0 | AC12: 0 | AD12: 0 | AE12: 0 | AF12: 0 | AG12: 0 | AH12: 0 | AI12: 0 | AJ12: 0 | AK12: 0 | AL12: 0 | AM12: 0 | AN12: 0 | AO12: 0 | AP12: 0 | AQ12: 0 | AR12: 0 | AS12: 0 | AT12: 0 | AU12: C
A13: 1997 Baltland | B13: Mussina | C13: Mike | D13: 30.3 | E13: 19 | F13: 35 | G13: 10 | H13: 28 | I13: 5 | J13: -4 | K13: 2 | L13: 2 | M13: 0 | N13: 7 | O13: 0 | P13: R | Q13: 20.4 | R13: 17.5 | S13: 19.5 | T13: 5.64 | U13: 13.37 | V13: 4 | W13: 4 | X13: 2 | Y13: 0 | Z13: 0 | AA13: 0 | AB13: 0 | AC13: 0 | AD13: 0 | AE13: 0 | AF13: 0 | AG13: 0 | AH13: 0 | AI13: 0 | AJ13: 0 | AK13: 0 | AL13: 0 | AM13: 0 | AN13: 0 | AO13: 0 | AP13: 0 | AQ13: 0 | AR13: 0 | AS13: 0 | AT13: 0 | AU13: C
A14: 1997 Baltland | B14: Key | C14: Jimmy | D14: 25.3 | E14: 17 | F14: 29 | G14: 12 | H14: 13 | I14: 1 | J14: -5 | K14: 2 | L14: 2 | M14: 0 | N14: 6 | O14: 0 | P14: L | Q14: 27 | R14: 32.6 | S14: 26.7 | T14: 6.05 | U14: 14.58 | V14: 4 | W14: 4 | X14: 2 | Y14: 0 | Z14: 0 | AA14: 0 | AB14: 0 | AC14: 0 | AD14: 0 | AE14: 0 | AF14: 0 | AG14: 0 | AH14: 0 | AI14: 0 | AJ14: 0 | AK14: 0 | AL14: 0 | AM14: 0 | AN14: 0 | AO14: 0 | AP14: 0 | AQ14: 0 | AR14: 0 | AS14: 0 | AT14: 0 | AU14: B
A15: 1997 Baltland | B15: Orosco | C15: Jesse | D15: 2 | E15: 2 | F15: 2 | G15: 2 | H15: 1 | I15: 0 | J15: -2 | K15: 0 | L15: 0 | M15: 0 | N15: 0 | O15: 1 | P15: L | Q15: 26.5 | R15: 19 | S15: 40.1 | T15: 9 | U15: 18 | V15: 0 | W15: 2 | X15: 0 | Y15: 0 | Z15: 0 | AA15: 0 | AB15: 0 | AC15: 0 | AD15: 0 | AE15: 0 | AF15: 0 | AG15: 0 | AH15: 0 | AI15: 0 | AJ15: 0 | AK15: 0 | AL15: 0 | AM15: 0 | AN15: 0 | AO15: 0 | AP15: 0 | AQ15: 0 | AR15: 0 | AS15: 0 | AT15: 0 | AU15: C
A16: 1997 Baltland | B16: Oquist | C16: Mike | D16: 6.6 | E16: 13 | F16: 15 | G16: 3 | H16: 3 | I16: 4 | J16: -5 | K16: 0 | L16: 0 | M16: 0 | N16: 5 | O16: 4 | P16: R | Q16: 30.75 | R16: 29.25 | S16: 30.5 | T16: 17.73 | U16: 24.55 | V16: 0 | W16: 2 | X16: 0 | Y16: 0 | Z16: 0 | AA16: 0 | AB16: 0 | AC16: 0 | AD16: 0 | AE16: 0 | AF16: 0 | AG16: 0 | AH16: 0 | AI16: 0 | AJ16: 0 | AK16: 0 | AL16: 0 | AM16: 0 | AN16: 0 | AO16: 0 | AP16: 0 | AQ16: 0 | AR16: 0 | AS16: 0 | AT16: 0 | AU16: B